Naziv korisnika;Konto;Klasa;Klasifikacija;Naziv;Iznos (KM)
Ured koordinatora za reformu javne uprave;611200;Rashodi;Rashodi po korisnicima - sintetički konto;Ured koordinatora za reformu javne uprave;102.243,00
Konkurencijsko vijece BiH;611200;Rashodi;Rashodi po korisnicima - sintetički konto;Konkurencijsko vijece BiH;100.474,00
Agencija za forenzicka ispitivanja i vještacenja;611200;Rashodi;Rashodi po korisnicima - sintetički konto;Agencija za forenzicka ispitivanja i vještacenja;98.570,00
Agencija za razvoj visokog obrazovanja i osiguranje kvaliteta;611200;Rashodi;Rashodi po korisnicima - sintetički konto;Agencija za razvoj visokog obrazovanja i osiguranje kvaliteta;98.388,00
Agencija za rad i zapošljavanje BiH;611200;Rashodi;Rashodi po korisnicima - sintetički konto;Agencija za rad i zapošljavanje BiH;95.721,00
Komisija za koncesije;611200;Rashodi;Rashodi po korisnicima - sintetički konto;Komisija za koncesije;93.894,00
Komisija za ocuvanje nacionalnih spomenika BiH;611200;Rashodi;Rashodi po korisnicima - sintetički konto;Komisija za ocuvanje nacionalnih spomenika BiH;91.608,00
Agencija za promociju stranih ulaganja u BiH;611200;Rashodi;Rashodi po korisnicima - sintetički konto;Agencija za promociju stranih ulaganja u BiH;90.993,00
Pravobranilaštvo BiH;611200;Rashodi;Rashodi po korisnicima - sintetički konto;Pravobranilaštvo BiH;88.660,00
Uprava za zaštitu zdravlja bilja;611200;Rashodi;Rashodi po korisnicima - sintetički konto;Uprava za zaštitu zdravlja bilja;88.356,00
Arhiv BiH;611200;Rashodi;Rashodi po korisnicima - sintetički konto;Arhiv BiH;78.055,00
Ured za zakonodavstvo;611200;Rashodi;Rashodi po korisnicima - sintetički konto;Ured za zakonodavstvo;75.670,00
Memorijalni centar Srebrenica;611200;Rashodi;Rashodi po korisnicima - sintetički konto;Memorijalni centar Srebrenica;75.511,00
Agencija za prevenciju korupcije i koordinaciju borbe protiv korupcije;611200;Rashodi;Rashodi po korisnicima - sintetički konto;Agencija za prevenciju korupcije i koordinaciju borbe protiv korupcije;74.596,00
Ured za razmatranje žalbi po javnim nabavkama;611200;Rashodi;Rashodi po korisnicima - sintetički konto;Ured za razmatranje žalbi po javnim nabavkama;72.921,00
Agencija za zaštitu licnih podataka;611200;Rashodi;Rashodi po korisnicima - sintetički konto;Agencija za zaštitu licnih podataka;72.454,00
Agencija za predškolsko, osnovno i srednje obrazovanje;611200;Rashodi;Rashodi po korisnicima - sintetički konto;Agencija za predškolsko, osnovno i srednje obrazovanje;70.981,00
Agencija za nadzor nad tržištem;611200;Rashodi;Rashodi po korisnicima - sintetički konto;Agencija za nadzor nad tržištem;67.223,00
Centar za informisanje i priznavanje dokumenata iz oblasti visokog obrazovanja;611200;Rashodi;Rashodi po korisnicima - sintetički konto;Centar za informisanje i priznavanje dokumenata iz oblasti visokog obrazovanja;63.453,00
Agencija za javne nabavke BiH;611200;Rashodi;Rashodi po korisnicima - sintetički konto;Agencija za javne nabavke BiH;62.092,00
Institut za akreditiranje BiH;611200;Rashodi;Rashodi po korisnicima - sintetički konto;Institut za akreditiranje BiH;59.009,00
Direkcija za ekonomsko planiranje;611200;Rashodi;Rashodi po korisnicima - sintetički konto;Direkcija za ekonomsko planiranje;57.303,00
Agencija za poštanski promet BiH;611200;Rashodi;Rashodi po korisnicima - sintetički konto;Agencija za poštanski promet BiH;57.134,00
Agencija za državnu službu BiH;611200;Rashodi;Rashodi po korisnicima - sintetički konto;Agencija za državnu službu BiH;55.923,00
Državna regulatorna agencija za radijacijsku i nuklearnu sigurnost;611200;Rashodi;Rashodi po korisnicima - sintetički konto;Državna regulatorna agencija za radijacijsku i nuklearnu sigurnost;51.076,00
Ured za harmonizaciju i koordinaciju sistema placanja u poljoprivredi, ishrani i ruralnom razvoju BiH;611200;Rashodi;Rashodi po korisnicima - sintetički konto;Ured za harmonizaciju i koordinaciju sistema placanja u poljoprivredi, ishrani i ruralnom razvoju BiH;50.277,00
Odbor državne službe za žalbe;611200;Rashodi;Rashodi po korisnicima - sintetički konto;Odbor državne službe za žalbe;32.929,00
Fond za povratak;611200;Rashodi;Rashodi po korisnicima - sintetički konto;Fond za povratak;31.888,00
Centralna harmonizacijska jedinica;611200;Rashodi;Rashodi po korisnicima - sintetički konto;Centralna harmonizacijska jedinica;31.518,00
Agencija za osiguranje u Bosni i Hercegovini;611200;Rashodi;Rashodi po korisnicima - sintetički konto;Agencija za osiguranje u Bosni i Hercegovini;28.269,00
Vijeće za državnu pomoć BiH;611200;Rashodi;Rashodi po korisnicima - sintetički konto;Vijeće za državnu pomoć BiH;25.259,00
Vijeće za državnu pomoć BiH;611200;Rashodi;Rashodi po korisnicima - analitički konto;Raspodjela uplaćenih sredstava Vijeću za državnu pomoć;13.292,00
Vijeće za državnu pomoć BiH;611200;Rashodi;Rashodi po korisnicima - analitički konto;Naknade troskova zaposlenih i skupstinskih zastupnika - ostalo;11.967,00
Institucija ombudsmena za zaštitu potrošaca;611200;Rashodi;Rashodi po korisnicima - sintetički konto;Institucija ombudsmena za zaštitu potrošaca;24.421,00
Agencija za antidoping kontrolu;611200;Rashodi;Rashodi po korisnicima - sintetički konto;Agencija za antidoping kontrolu;23.265,00
Jedinica za implementaciju projekta izgradnje zavoda za izvršenje krivicnih sankcija, pritvora i drugih mjera BiH;611200;Rashodi;Rashodi po korisnicima - sintetički konto;Jedinica za implementaciju projekta izgradnje zavoda za izvršenje krivicnih sankcija, pritvora i drugih mjera BiH;7.236,00
Bosna i Hercegovina;-;Rashodi;Grupa;Rashodi za materijal i usluge;175.125.673,00
Bosna i Hercegovina;613000;Rashodi;Podgrupa;Izdaci za materijal i usluge;175.125.673,00
Bosna i Hercegovina;613100;Rashodi;Rashodi po korisnicima - sumarno;Putni troškovi;12.683.830,00
Ministarstvo odbrane BiH;613100;Rashodi;Rashodi po korisnicima - sintetički konto;Ministarstvo odbrane BiH;3.159.008,00
Direkcija za koordinaciju policijskih tijela;613100;Rashodi;Rashodi po korisnicima - sintetički konto;Direkcija za koordinaciju policijskih tijela;1.341.157,00
Ministarstvo vanjskih poslova BiH;613100;Rashodi;Rashodi po korisnicima - sintetički konto;Ministarstvo vanjskih poslova BiH;1.288.435,00
Parlamentarna skupština BiH;613100;Rashodi;Rashodi po korisnicima - sintetički konto;Parlamentarna skupština BiH;577.944,00
Parlamentarna skupština BiH;613100;Rashodi;Rashodi po korisnicima - analitički konto;Putni troskovi - ostali;572.535,00
Parlamentarna skupština BiH;613100;Rashodi;Rashodi po korisnicima - analitički konto;Klubovi poslanika parlamentalnih stranaka;3.601,00
Parlamentarna skupština BiH;613100;Rashodi;Rashodi po korisnicima - analitički konto;Nezavisna komisija za praćenje uslova boravka u zavodima, postupanje i poštivanje ljudskih prava lica nad kojima se izvršavaju krivične sankcije i druge mjere koje je izrekao Sud BiH;1.215,00
Parlamentarna skupština BiH;613100;Rashodi;Rashodi po korisnicima - analitički konto;Pomoć uredu parlamentalnog vojnog povjerenika;593,00
Državna agencija za istrage i zaštitu;613100;Rashodi;Rashodi po korisnicima - sintetički konto;Državna agencija za istrage i zaštitu;371.195,00
Tužilaštvo BiH;613100;Rashodi;Rashodi po korisnicima - sintetički konto;Tužilaštvo BiH;369.399,00
Tužilaštvo BiH;613100;Rashodi;Rashodi po korisnicima - analitički konto;Putni troskovi - ostalo;335.919,00
Tužilaštvo BiH;613100;Rashodi;Rashodi po korisnicima - analitički konto;Tužilaštvo BiH IPA 2012/2013;20.737,00
Tužilaštvo BiH;613100;Rashodi;Rashodi po korisnicima - analitički konto;Podrška efikasnom poricesuiranju predmeta ratnih zločinaca u BiH;12.112,00
Tužilaštvo BiH;613100;Rashodi;Rashodi po korisnicima - analitički konto;Udarni tim za sprečavanje trgovine ljudima;631,00
Regulatorna agencija za komunikacije BiH;613100;Rashodi;Rashodi po korisnicima - sintetički konto;Regulatorna agencija za komunikacije BiH;362.477,00
Visoko sudsko i tužilacko vijece BiH;613100;Rashodi;Rashodi po korisnicima - sintetički konto;Visoko sudsko i tužilacko vijece BiH;338.078,00
Visoko sudsko i tužilacko vijece BiH;613100;Rashodi;Rashodi po korisnicima - analitički konto;Putni troskovi - ostalo;176.999,00
Visoko sudsko i tužilacko vijece BiH;613100;Rashodi;Rashodi po korisnicima - analitički konto;Norveška vlada za VSTS 2011-2014;88.533,00
Visoko sudsko i tužilacko vijece BiH;613100;Rashodi;Rashodi po korisnicima - analitički konto;Unapređenje pravosudnih kapaciteta za adekvatnu implementaciju mjera za zaštitu svjedoka;27.972,00
Visoko sudsko i tužilacko vijece BiH;613100;Rashodi;Rashodi po korisnicima - analitički konto;IPA 2012 - Konsolidacija i daljnji razvitak pravosudnog komunikacionog sistema;18.131,00
Visoko sudsko i tužilacko vijece BiH;613100;Rashodi;Rashodi po korisnicima - analitički konto;Projekat za unapređenje efikasnosti pravosuđa;18.003,00
Visoko sudsko i tužilacko vijece BiH;613100;Rashodi;Rashodi po korisnicima - analitički konto;SWISS 2010/2012;5.281,00
Visoko sudsko i tužilacko vijece BiH;613100;Rashodi;Rashodi po korisnicima - analitički konto;IPA 2010 Jačanje pravosuđa BiH;2.973,00
Visoko sudsko i tužilacko vijece BiH;613100;Rashodi;Rashodi po korisnicima - analitički konto;SWISS 2014-2018;186,00
Predsjedništvo BiH;613100;Rashodi;Rashodi po korisnicima - sintetički konto;Predsjedništvo BiH;329.629,00
Predsjedništvo BiH;613100;Rashodi;Rashodi po korisnicima - analitički konto;Putni troskovi - ostali;303.712,00
Predsjedništvo BiH;613100;Rashodi;Rashodi po korisnicima - analitički konto;Ured oficira za vezu u Hagu - bošnjački;9.039,00
Predsjedništvo BiH;613100;Rashodi;Rashodi po korisnicima - analitički konto;Ured oficira za vezu u Hagu - srpski;8.822,00
Predsjedništvo BiH;613100;Rashodi;Rashodi po korisnicima - analitički konto;Ured oficira za vezu u Hagu - hrvatski;8.056,00
Uprava za indirektno oporezivanje BiH;613100;Rashodi;Rashodi po korisnicima - sintetički konto;Uprava za indirektno oporezivanje BiH;308.760,00
Uprava za indirektno oporezivanje BiH;613100;Rashodi;Rashodi po korisnicima - analitički konto;Putni troskovi - ostalo;270.717,00
Uprava za indirektno oporezivanje BiH;613100;Rashodi;Rashodi po korisnicima - analitički konto;IPA 2011 Daljnje usklađivanje carina i oporezivanje s EU praksom i zakonodavstvom - namjenska sredstva;35.477,00
Uprava za indirektno oporezivanje BiH;613100;Rashodi;Rashodi po korisnicima - analitički konto;Upravni odbor;2.566,00
Direkcija za civilno vazduhoplovstvo BiH;613100;Rashodi;Rashodi po korisnicima - sintetički konto;Direkcija za civilno vazduhoplovstvo BiH;299.421,00
Obavještajno- sigurnosna agencija BiH;613100;Rashodi;Rashodi po korisnicima - sintetički konto;Obavještajno- sigurnosna agencija BiH;239.406,00
Ministarstvo za ljudska prava i izbjeglice BiH;613100;Rashodi;Rashodi po korisnicima - sintetički konto;Ministarstvo za ljudska prava i izbjeglice BiH;238.725,00
Ministarstvo civilnih poslova BiH;613100;Rashodi;Rashodi po korisnicima - sintetički konto;Ministarstvo civilnih poslova BiH;225.262,00
Granicna policija BiH;613100;Rashodi;Rashodi po korisnicima - sintetički konto;Granicna policija BiH;213.444,00
Generalni sekretarijat Vijeca ministara BiH;613100;Rashodi;Rashodi po korisnicima - sintetički konto;Generalni sekretarijat Vijeca ministara BiH;213.083,00
Ministarstvo sigurnosti BiH;613100;Rashodi;Rashodi po korisnicima - sintetički konto;Ministarstvo sigurnosti BiH;206.710,00
Direkcija za evropske integracije BiH;613100;Rashodi;Rashodi po korisnicima - sintetički konto;Direkcija za evropske integracije BiH;174.163,00
Ministarstvo vanjske trgovine i ekonomskih odnosa BiH;613100;Rashodi;Rashodi po korisnicima - sintetički konto;Ministarstvo vanjske trgovine i ekonomskih odnosa BiH;168.996,00
Ministarstvo vanjske trgovine i ekonomskih odnosa BiH;613100;Rashodi;Rashodi po korisnicima - analitički konto;Putni troskovi - ostalo;151.609,00
Ministarstvo vanjske trgovine i ekonomskih odnosa BiH;613100;Rashodi;Rashodi po korisnicima - analitički konto;Alterenergy;17.387,00
Agencija za identifikaciju dokumenata, evidenciju i razmjenu podataka;613100;Rashodi;Rashodi po korisnicima - sintetički konto;Agencija za identifikaciju dokumenata, evidenciju i razmjenu podataka;139.021,00
Ministarstvo pravde BiH;613100;Rashodi;Rashodi po korisnicima - sintetički konto;Ministarstvo pravde BiH;134.975,00
Ministarstvo komunikacija i prometa BiH;613100;Rashodi;Rashodi po korisnicima - sintetički konto;Ministarstvo komunikacija i prometa BiH;129.929,00
Institut za mjeriteljstvo BiH;613100;Rashodi;Rashodi po korisnicima - sintetički konto;Institut za mjeriteljstvo BiH;118.959,00
Agencija za statistiku BiH;613100;Rashodi;Rashodi po korisnicima - sintetički konto;Agencija za statistiku BiH;108.013,00
Agencija za lijekove i medicinska sredstva BiH;613100;Rashodi;Rashodi po korisnicima - sintetički konto;Agencija za lijekove i medicinska sredstva BiH;106.363,00
Služba za poslove sa strancima;613100;Rashodi;Rashodi po korisnicima - sintetički konto;Služba za poslove sa strancima;96.552,00
Služba za poslove sa strancima;613100;Rashodi;Rashodi po korisnicima - analitički konto;Prevencija ilegalnih migracija u BiH i regionu i dobrovoljni povratak ilegalnih migranata;57.425,00
Služba za poslove sa strancima;613100;Rashodi;Rashodi po korisnicima - analitički konto;Putni troskovi - ostalo;39.127,00
Ministarstvo finansija i trezora BiH;613100;Rashodi;Rashodi po korisnicima - sintetički konto;Ministarstvo finansija i trezora BiH;92.735,00
Institut za akreditiranje BiH;613100;Rashodi;Rashodi po korisnicima - sintetički konto;Institut za akreditiranje BiH;85.212,00
Ustavni sud BiH;613100;Rashodi;Rashodi po korisnicima - sintetički konto;Ustavni sud BiH;83.332,00
Ustavni sud BiH;613100;Rashodi;Rashodi po korisnicima - analitički konto;Putni troskovi - ostalo;82.483,00
Ustavni sud BiH;613100;Rashodi;Rashodi po korisnicima - analitički konto;Podrška Ustavnom sudu BiH;849,00
Ured za reviziju institucija BiH;613100;Rashodi;Rashodi po korisnicima - sintetički konto;Ured za reviziju institucija BiH;80.794,00
Ured za reviziju institucija BiH;613100;Rashodi;Rashodi po korisnicima - analitički konto;Putni troskovi;80.269,00
Ured za reviziju institucija BiH;613100;Rashodi;Rashodi po korisnicima - analitički konto;Koordinacioni odbor;525,00
Ured za veterinarstvo BiH;613100;Rashodi;Rashodi po korisnicima - sintetički konto;Ured za veterinarstvo BiH;78.898,00
Ured za veterinarstvo BiH;613100;Rashodi;Rashodi po korisnicima - analitički konto;Putni troskovi - ostalo;78.119,00
Ured za veterinarstvo BiH;613100;Rashodi;Rashodi po korisnicima - analitički konto;IPA 2007 - 2013 Jadranski program prekogranične saradnje - namjenska sredstva;779,00
Središnja izborna komisija BiH;613100;Rashodi;Rashodi po korisnicima - sintetički konto;Središnja izborna komisija BiH;67.231,00
Agencija za rad i zapošljavanje BiH;613100;Rashodi;Rashodi po korisnicima - sintetički konto;Agencija za rad i zapošljavanje BiH;61.582,00
Institucija ombudsmana za ljudska prava BiH;613100;Rashodi;Rashodi po korisnicima - sintetički konto;Institucija ombudsmana za ljudska prava BiH;55.341,00
Institut za intelektualno vlasništvo BiH;613100;Rashodi;Rashodi po korisnicima - sintetički konto;Institut za intelektualno vlasništvo BiH;52.502,00
Komisija za ocuvanje nacionalnih spomenika BiH;613100;Rashodi;Rashodi po korisnicima - sintetički konto;Komisija za ocuvanje nacionalnih spomenika BiH;52.408,00
Centar za uklanjanje mina u BiH;613100;Rashodi;Rashodi po korisnicima - sintetički konto;Centar za uklanjanje mina u BiH;49.663,00
Agencija za razvoj visokog obrazovanja i osiguranje kvaliteta;613100;Rashodi;Rashodi po korisnicima - sintetički konto;Agencija za razvoj visokog obrazovanja i osiguranje kvaliteta;43.795,00
Agencija za antidoping kontrolu;613100;Rashodi;Rashodi po korisnicima - sintetički konto;Agencija za antidoping kontrolu;43.293,00
Institut za standardizaciju BiH;613100;Rashodi;Rashodi po korisnicima - sintetički konto;Institut za standardizaciju BiH;39.974,00
Sud BiH;613100;Rashodi;Rashodi po korisnicima - sintetički konto;Sud BiH;37.498,00
Sud BiH;613100;Rashodi;Rashodi po korisnicima - analitički konto;Putni troskovi - ostalo;36.788,00
Sud BiH;613100;Rashodi;Rashodi po korisnicima - analitički konto;Donacija EU za Sud BiH - IPA 2012;710,00
Agencija za policijsku podršku;613100;Rashodi;Rashodi po korisnicima - sintetički konto;Agencija za policijsku podršku;36.563,00
Agencija za predškolsko, osnovno i srednje obrazovanje;613100;Rashodi;Rashodi po korisnicima - sintetički konto;Agencija za predškolsko, osnovno i srednje obrazovanje;36.032,00
Državna regulatorna agencija za radijacijsku i nuklearnu sigurnost;613100;Rashodi;Rashodi po korisnicima - sintetički konto;Državna regulatorna agencija za radijacijsku i nuklearnu sigurnost;35.902,00
Konkurencijsko vijece BiH;613100;Rashodi;Rashodi po korisnicima - sintetički konto;Konkurencijsko vijece BiH;28.259,00
Uprava za zaštitu zdravlja bilja;613100;Rashodi;Rashodi po korisnicima - sintetički konto;Uprava za zaštitu zdravlja bilja;26.732,00
Uprava za zaštitu zdravlja bilja;613100;Rashodi;Rashodi po korisnicima - analitički konto;Putni troskovi - ostalo;20.630,00
Uprava za zaštitu zdravlja bilja;613100;Rashodi;Rashodi po korisnicima - analitički konto;IPA 2009 Jačanje kapaciteta fitosanitarnog sistema u BiH;6.102,00
Agencija za sigurnost hrane;613100;Rashodi;Rashodi po korisnicima - sintetički konto;Agencija za sigurnost hrane;24.699,00
Direkcija za ekonomsko planiranje;613100;Rashodi;Rashodi po korisnicima - sintetički konto;Direkcija za ekonomsko planiranje;24.120,00
Agencija za forenzicka ispitivanja i vještacenja;613100;Rashodi;Rashodi po korisnicima - sintetički konto;Agencija za forenzicka ispitivanja i vještacenja;23.835,00
Centar za informisanje i priznavanje dokumenata iz oblasti visokog obrazovanja;613100;Rashodi;Rashodi po korisnicima - sintetički konto;Centar za informisanje i priznavanje dokumenata iz oblasti visokog obrazovanja;22.592,00
Institut za nestale osobe;613100;Rashodi;Rashodi po korisnicima - sintetički konto;Institut za nestale osobe;20.661,00
Agencija za promociju stranih ulaganja u BiH;613100;Rashodi;Rashodi po korisnicima - sintetički konto;Agencija za promociju stranih ulaganja u BiH;20.127,00
Agencija za nadzor nad tržištem;613100;Rashodi;Rashodi po korisnicima - sintetički konto;Agencija za nadzor nad tržištem;19.110,00
Arhiv BiH;613100;Rashodi;Rashodi po korisnicima - sintetički konto;Arhiv BiH;18.913,00
Agencija za zaštitu licnih podataka;613100;Rashodi;Rashodi po korisnicima - sintetički konto;Agencija za zaštitu licnih podataka;17.040,00
Agencija za školovanje i strucno usavršavanje kadrova;613100;Rashodi;Rashodi po korisnicima - sintetički konto;Agencija za školovanje i strucno usavršavanje kadrova;16.301,00
Agencija za poštanski promet BiH;613100;Rashodi;Rashodi po korisnicima - sintetički konto;Agencija za poštanski promet BiH;15.253,00
Agencija za osiguranje u Bosni i Hercegovini;613100;Rashodi;Rashodi po korisnicima - sintetički konto;Agencija za osiguranje u Bosni i Hercegovini;13.925,00
Pravobranilaštvo BiH;613100;Rashodi;Rashodi po korisnicima - sintetički konto;Pravobranilaštvo BiH;13.896,00
Agencija za prevenciju korupcije i koordinaciju borbe protiv korupcije;613100;Rashodi;Rashodi po korisnicima - sintetički konto;Agencija za prevenciju korupcije i koordinaciju borbe protiv korupcije;13.486,00
Ured za harmonizaciju i koordinaciju sistema placanja u poljoprivredi, ishrani i ruralnom razvoju BiH;613100;Rashodi;Rashodi po korisnicima - sintetički konto;Ured za harmonizaciju i koordinaciju sistema placanja u poljoprivredi, ishrani i ruralnom razvoju BiH;10.433,00
Ured koordinatora za reformu javne uprave;613100;Rashodi;Rashodi po korisnicima - sintetički konto;Ured koordinatora za reformu javne uprave;10.050,00
Služba za zajednicke poslove institucija BiH;613100;Rashodi;Rashodi po korisnicima - sintetički konto;Služba za zajednicke poslove institucija BiH;7.939,00
Agencija za javne nabavke BiH;613100;Rashodi;Rashodi po korisnicima - sintetički konto;Agencija za javne nabavke BiH;6.905,00
Centralna harmonizacijska jedinica;613100;Rashodi;Rashodi po korisnicima - sintetički konto;Centralna harmonizacijska jedinica;6.373,00
Agencija za državnu službu BiH;613100;Rashodi;Rashodi po korisnicima - sintetički konto;Agencija za državnu službu BiH;5.670,00
Komisija za koncesije;613100;Rashodi;Rashodi po korisnicima - sintetički konto;Komisija za koncesije;5.349,00
Fond za povratak;613100;Rashodi;Rashodi po korisnicima - sintetički konto;Fond za povratak;5.119,00
Ured za razmatranje žalbi po javnim nabavkama;613100;Rashodi;Rashodi po korisnicima - sintetički konto;Ured za razmatranje žalbi po javnim nabavkama;3.937,00
Jedinica za implementaciju projekta izgradnje zavoda za izvršenje krivicnih sankcija, pritvora i drugih mjera BiH;613100;Rashodi;Rashodi po korisnicima - sintetički konto;Jedinica za implementaciju projekta izgradnje zavoda za izvršenje krivicnih sankcija, pritvora i drugih mjera BiH;3.628,00
Institucija ombudsmena za zaštitu potrošaca;613100;Rashodi;Rashodi po korisnicima - sintetički konto;Institucija ombudsmena za zaštitu potrošaca;2.992,00
Memorijalni centar Srebrenica;613100;Rashodi;Rashodi po korisnicima - sintetički konto;Memorijalni centar Srebrenica;2.208,00
Odbor državne službe za žalbe;613100;Rashodi;Rashodi po korisnicima - sintetički konto;Odbor državne službe za žalbe;1.696,00
Ured za zakonodavstvo;613100;Rashodi;Rashodi po korisnicima - sintetički konto;Ured za zakonodavstvo;371,00
Vijeće za državnu pomoć BiH;613100;Rashodi;Rashodi po korisnicima - sintetički konto;Vijeće za državnu pomoć BiH;355,00
Bosna i Hercegovina;613200;Rashodi;Rashodi po korisnicima - sumarno;Izdaci telefonskih i poštanskih usluga;8.288.318,00
Uprava za indirektno oporezivanje BiH;613200;Rashodi;Rashodi po korisnicima - sintetički konto;Izdaci telefonskih i poštanskih usluga;1.884.442,00
Uprava za indirektno oporezivanje BiH;613200;Rashodi;Rashodi po korisnicima - analitički konto;Izdaci za telefonske i poštanske usluge;1.881.882,00
Uprava za indirektno oporezivanje BiH;613200;Rashodi;Rashodi po korisnicima - analitički konto;Upravni odbor;1.733,00
Uprava za indirektno oporezivanje BiH;613200;Rashodi;Rashodi po korisnicima - analitički konto;IPA 2011 Daljnje usklađivanje carina i oporezivanje s EU praksom i zakonodavstvom - namjenska sredstva;827,00
Ministarstvo vanjskih poslova BiH;613200;Rashodi;Rashodi po korisnicima - sintetički konto;Izdaci telefonskih i poštanskih usluga;1.119.641,00
Ministarstvo odbrane BiH;613200;Rashodi;Rashodi po korisnicima - sintetički konto;Izdaci telefonskih i poštanskih usluga;745.839,00
Obavještajno- sigurnosna agencija BiH;613200;Rashodi;Rashodi po korisnicima - sintetički konto;Izdaci telefonskih i poštanskih usluga;352.288,00
Granicna policija BiH;613200;Rashodi;Rashodi po korisnicima - sintetički konto;Izdaci telefonskih i poštanskih usluga;301.872,00
Sud BiH;613200;Rashodi;Rashodi po korisnicima - sintetički konto;Izdaci telefonskih i poštanskih usluga;245.930,00
Državna agencija za istrage i zaštitu;613200;Rashodi;Rashodi po korisnicima - sintetički konto;Izdaci telefonskih i poštanskih usluga;245.419,00
Predsjedništvo BiH;613200;Rashodi;Rashodi po korisnicima - sintetički konto;Izdaci telefonskih i poštanskih usluga;184.512,00
Predsjedništvo BiH;613200;Rashodi;Rashodi po korisnicima - analitički konto;Izdaci za telefonske i poštanske usluge;140.262,00
Predsjedništvo BiH;613200;Rashodi;Rashodi po korisnicima - analitički konto;Ured oficira za vezu u Hagu - bošnjački;26.802,00
Predsjedništvo BiH;613200;Rashodi;Rashodi po korisnicima - analitički konto;Ured oficira za vezu u Hagu - srpski;10.428,00
Predsjedništvo BiH;613200;Rashodi;Rashodi po korisnicima - analitički konto;Ured oficira za vezu u Hagu - hrvatski;7.020,00
Parlamentarna skupština BiH;613200;Rashodi;Rashodi po korisnicima - sintetički konto;Izdaci telefonskih i poštanskih usluga;177.112,00
Parlamentarna skupština BiH;613200;Rashodi;Rashodi po korisnicima - analitički konto;Izdaci za telefonske i poštanske usluge;163.410,00
Parlamentarna skupština BiH;613200;Rashodi;Rashodi po korisnicima - analitički konto;Klubovi poslanika parlamentalnih stranaka;13.702,00
Ministarstvo pravde BiH;613200;Rashodi;Rashodi po korisnicima - sintetički konto;Izdaci telefonskih i poštanskih usluga;148.350,00
Ministarstvo pravde BiH;613200;Rashodi;Rashodi po korisnicima - analitički konto;Izdaci za telefonske i poštanske usluge;148.320,00
Ministarstvo pravde BiH;613200;Rashodi;Rashodi po korisnicima - analitički konto;IPA 2012 podrška za efikasno procesuiranje ratnih zločina - OKO;30,00
Ministarstvo finansija i trezora BiH;613200;Rashodi;Rashodi po korisnicima - sintetički konto;Izdaci telefonskih i poštanskih usluga;144.214,00
Središnja izborna komisija BiH;613200;Rashodi;Rashodi po korisnicima - sintetički konto;Izdaci telefonskih i poštanskih usluga;136.962,00
Ministarstvo komunikacija i prometa BiH;613200;Rashodi;Rashodi po korisnicima - sintetički konto;Izdaci telefonskih i poštanskih usluga;130.214,00
Ministarstvo civilnih poslova BiH;613200;Rashodi;Rashodi po korisnicima - sintetički konto;Izdaci telefonskih i poštanskih usluga;127.776,00
Agencija za identifikaciju dokumenata, evidenciju i razmjenu podataka;613200;Rashodi;Rashodi po korisnicima - sintetički konto;Izdaci telefonskih i poštanskih usluga;125.302,00
Tužilaštvo BiH;613200;Rashodi;Rashodi po korisnicima - sintetički konto;Izdaci telefonskih i poštanskih usluga;114.087,00
Tužilaštvo BiH;613200;Rashodi;Rashodi po korisnicima - analitički konto;Izdaci za telefonske i poštanske usluge;93.030,00
